{
  "registry_version": "1.0.0",
  "max_review_age_days": 180,
  "generated_by": "scripts/verify_skill_registry.py contract; entries derived from .agent/skills/*/SKILL.md frontmatter",
  "skills": [
    {
      "id": "cv_hardware_diagnostics",
      "version": "1.0.0",
      "license": "Apache-2.0",
      "path": ".agent/skills/cv_hardware_diagnostics/SKILL.md",
      "l1_routing": {
        "name": "CV Hardware Diagnostics",
        "intent": "Run cv hardware diagnostics for esp32 and opencv pipelines using serial pre-check and staged fail-fast validation.",
        "triggers": [
          "cv hardware",
          "esp32",
          "opencv",
          "serial pre-check"
        ]
      },
      "l2_signature": {
        "execution_profile": [
          "engineering"
        ],
        "trust_tier": "reviewed",
        "json_schema": {
          "type": "object",
          "properties": {
            "target_stack": {
              "type": "string"
            },
            "symptoms": {
              "type": "string"
            },
            "environment_constraints": {
              "type": "array",
              "items": {
                "type": "string"
              }
            }
          },
          "required": [
            "target_stack",
            "symptoms"
          ]
        }
      },
      "compatibility": {
        "runtime": [
          "python>=3.10"
        ],
        "os": [
          "linux",
          "windows",
          "macos"
        ]
      },
      "trust": {
        "tier": "reviewed",
        "review_owner": "Fan-Wei Huang",
        "reviewed_at": "2026-07-02"
      },
      "integrity": {
        "sha256": "30a4e013805b6b8bd9a41a84075e64d0f1a4330a50f89d6167eb8c859a30df66"
      }
    },
    {
      "id": "local_llm",
      "version": "1.0.0",
      "license": "Apache-2.0",
      "path": ".agent/skills/local_llm/SKILL.md",
      "l1_routing": {
        "name": "Local LLM",
        "intent": "Delegate secure offline subtasks to Ollama-hosted local models.",
        "triggers": [
          "local llm",
          "ollama",
          "qwen3",
          "offline model"
        ]
      },
      "l2_signature": {
        "execution_profile": [
          "engineering"
        ],
        "trust_tier": "reviewed",
        "json_schema": {
          "type": "object",
          "properties": {
            "prompt": {
              "type": "string"
            },
            "task": {
              "type": "string"
            },
            "constraints": {
              "type": "array",
              "items": {
                "type": "string"
              }
            }
          },
          "required": [
            "prompt"
          ]
        }
      },
      "compatibility": {
        "runtime": [
          "python>=3.10"
        ],
        "os": [
          "linux",
          "windows",
          "macos"
        ]
      },
      "trust": {
        "tier": "reviewed",
        "review_owner": "Fan-Wei Huang",
        "reviewed_at": "2026-07-02"
      },
      "integrity": {
        "sha256": "ad0028479388ef5e291f859a49884b42ad07482268e0eed138e4fef91c961de2"
      }
    },
    {
      "id": "qa_auditor",
      "version": "1.0.0",
      "license": "Apache-2.0",
      "path": ".agent/skills/qa_auditor/SKILL.md",
      "l1_routing": {
        "name": "QA Auditor",
        "intent": "Run red team D3/D4-oriented audits to expose system-breaking weaknesses.",
        "triggers": [
          "qa audit",
          "red team",
          "chaos testing",
          "adversarial test"
        ]
      },
      "l2_signature": {
        "execution_profile": [
          "engineering"
        ],
        "trust_tier": "reviewed",
        "json_schema": {
          "type": "object",
          "properties": {
            "target_module": {
              "type": "string"
            },
            "audit_scope": {
              "type": "string"
            },
            "threat_focus": {
              "type": "array",
              "items": {
                "type": "string"
              }
            }
          },
          "required": [
            "target_module"
          ]
        }
      },
      "compatibility": {
        "runtime": [
          "python>=3.10"
        ],
        "os": [
          "linux",
          "windows",
          "macos"
        ]
      },
      "trust": {
        "tier": "reviewed",
        "review_owner": "Fan-Wei Huang",
        "reviewed_at": "2026-07-02"
      },
      "integrity": {
        "sha256": "af5b359183276577a188fe8335582cec92048cae6600f4ec31ad276eaeb4b4fe"
      }
    },
    {
      "id": "tonesoul_governance",
      "version": "1.0.0",
      "license": "Apache-2.0",
      "path": ".agent/skills/tonesoul_governance/SKILL.md",
      "l1_routing": {
        "name": "ToneSoul Governance",
        "intent": "Apply governance and semantic tension evaluation to distinguish resonance detection from compliance and preserve memory crystallization rules.",
        "triggers": [
          "governance",
          "semantic tension",
          "resonance detection",
          "memory crystallization"
        ]
      },
      "l2_signature": {
        "execution_profile": [
          "engineering"
        ],
        "trust_tier": "reviewed",
        "json_schema": {
          "type": "object",
          "properties": {
            "task": {
              "type": "string"
            },
            "target_module": {
              "type": "string"
            },
            "constraints": {
              "type": "array",
              "items": {
                "type": "string"
              }
            }
          },
          "required": [
            "task"
          ]
        }
      },
      "compatibility": {
        "runtime": [
          "python>=3.10"
        ],
        "os": [
          "linux",
          "windows",
          "macos"
        ]
      },
      "trust": {
        "tier": "reviewed",
        "review_owner": "Fan-Wei Huang",
        "reviewed_at": "2026-07-02"
      },
      "integrity": {
        "sha256": "42e5c34f51b50776c666f3c8a3e63cb9530a7cea21d774e1fb5c35b3a4ede8cb"
      }
    },
    {
      "id": "tonesoul_philosophy",
      "version": "1.0.0",
      "license": "Apache-2.0",
      "path": ".agent/skills/tonesoul_philosophy/SKILL.md",
      "l1_routing": {
        "name": "ToneSoul Philosophy",
        "intent": "Explain ToneSoul philosophy through resonance and binding force, showing why prompt engineering alone is not sufficient.",
        "triggers": [
          "tonesoul philosophy",
          "resonance",
          "binding force",
          "prompt engineering"
        ]
      },
      "l2_signature": {
        "execution_profile": [
          "interactive"
        ],
        "trust_tier": "reviewed",
        "json_schema": {
          "type": "object",
          "properties": {
            "audience": {
              "type": "string"
            },
            "focus": {
              "type": "string"
            },
            "references": {
              "type": "array",
              "items": {
                "type": "string"
              }
            }
          },
          "required": [
            "audience"
          ]
        }
      },
      "compatibility": {
        "runtime": [
          "python>=3.10"
        ],
        "os": [
          "linux",
          "windows",
          "macos"
        ]
      },
      "trust": {
        "tier": "reviewed",
        "review_owner": "Fan-Wei Huang",
        "reviewed_at": "2026-07-02"
      },
      "integrity": {
        "sha256": "dbc5e44ff73e7151d23f88b08d2650000777be68e0ab430c12072907013a6271"
      }
    }
  ]
}
